{
  "$schema": "./config.schema.json",
  "site": {
    "title": "Benchmarking Federated Learning & Knowledge Distillation for Point Cloud Classification",
    "venue": "ECCV 2026",
    "description": "A multi-seed benchmark that jointly evaluates 13 federated learning algorithms and 10 knowledge distillation objectives for 3D point cloud classification across their full 130-pair cross-product, on ModelNet40 and a clinical craniosynostosis dataset, exposing an evaluation pitfall in combined FL+KD pipelines.",
    "keywords": "Federated Learning, Knowledge Distillation, 3D Point Cloud, Model Compression, Non-IID Label Skew, PointNet++, ModelNet40, Craniosynostosis, Privacy-Preserving Learning, Benchmark, ECCV 2026",
    "favicon": "favicon.ico",
    "lang": "en",
    "url": "https://ezharjan.github.io/FLKD3DBenchmark/",
    "publicationDate": "2026"
  },
  "authors": [
    {
      "name": "Aizierjiang Aiersilan",
      "url": "https://ezharjan.github.io/",
      "affiliations": [1],
      "note": ""
    }
  ],
  "affiliations": [
    { "id": 1, "name": "University of Macau" }
  ],
  "links": [
    { "type": "paper", "label": "Paper", "icon": "fas fa-file-pdf", "url": "https://eccv.ecva.net/PENDING", "enabled": true },
    { "type": "appendix", "label": "Appendix", "icon": "fas fa-file-alt", "url": "Appendix.pdf", "enabled": true },
    { "type": "confab", "label": "Confab", "icon": "fas fa-chalkboard-teacher", "url": "https://cal.com/ezhar/30min", "enabled": true },
    { "type": "poster", "label": "Poster", "icon": "fas fa-image", "url": "paper_poster.pdf", "enabled": false },
    { "type": "dataset", "label": "Dataset", "icon": "fas fa-database", "url": "https://github.com/Ezharjan/FLKD3DBenchmark/tree/master/data", "enabled": true },
    { "type": "checkpoints", "label": "Checkpoints", "icon": "fas fa-cubes", "url": "https://huggingface.co/ezharjan/FLKD3DBenchmark", "enabled": true },
    { "type": "code", "label": "Code", "icon": "fab fa-github", "url": "https://github.com/Ezharjan/FLKD3DBenchmark/", "enabled": true },
    { "type": "arxiv", "label": "arXiv", "icon": "ai ai-arxiv", "url": "https://arxiv.org/abs/2607.PENDING", "enabled": true }
  ],
  "abstract": {
    "title": "Abstract",
    "body": "Deploying 3D point cloud analysis in privacy-sensitive and resource-constrained settings faces two coupled barriers: data cannot be centralized for training, and the trained model must run on limited edge hardware. We present a multi-seed benchmark that jointly evaluates federated learning (FL) and knowledge distillation (KD) for 3D point cloud classification. It spans <b>thirteen FL algorithms</b> and <b>ten KD objectives</b>, supporting their full <b>130-pair</b> teacher–objective cross-product per dataset; every standardized configuration is repeated over three random seeds for <b>504 training runs</b> in total, with the complete combined grid evaluated at multi-seed scale on the clinical dataset. We characterize federated degradation and the combined-pipeline pitfall on ModelNet40, then validate them on a real-world clinical <b>craniosynostosis</b> dataset of patient head shapes, where the privacy and edge-deployment stakes are concrete. We report three findings. First, under extreme non-independent and identically distributed (non-IID) label skew, standalone FL degrades sharply: on ModelNet40 the strongest method reaches only <b>76.32%</b> against a <b>92.26%</b> centralized reference, on the clinical data the best reaches <b>75.83%</b> against 100%, and the four server-side optimizers collapse to near the chance level; the best algorithm differs by dataset, so none is universally robust. Second, distillation compresses the teacher into a student <b>74.51% smaller</b> and roughly twice as fast at inference, with five of the seven objectives evaluated on ModelNet40 matching or surpassing the <b>92.44%</b> teacher. Third, the combined pipeline exposes an evaluation pitfall: when distillation keeps a hard-label cross-entropy term on a labeled proxy split, a collapsed federated teacher at <b>8.50%</b> paired with Logit-MSE still yields a <b>92.94%</b> student. This <b>84.4-point</b> gap reflects the proxy labels rather than the federated model, and the hard-label term reuses the very labels whose privacy motivated federation. Objectives without a hard-label term instead track teacher quality (<i>r</i> ≈ 0.99 on the clinical grid) and collapse when the teacher does. We therefore recommend evaluating FL-KD pipelines with <b>label-free distillation</b>, so that the reported accuracy reflects the federated teacher rather than the proxy."
  },
  "sections": [
    {
      "type": "list",
      "title": "Contributions",
      "ordered": true,
      "align": "left",
      "items": [
        "<b>Benchmark design.</b> Thirteen FL algorithms, a centralized baseline, and ten KD objectives, with the complete two-stage cross-product of all <b>130 teacher–objective pairs</b> per dataset. The standardized multi-seed evaluation spans <b>504 training runs</b> over three seeds; the framework is open-source and extends to new FL algorithms, KD objectives, students, and datasets through one shared interface.",
        "<b>Quantified degradation under label skew.</b> On ModelNet40 the strongest FL method trails the centralized reference by about 16 points (FedNova, <b>76.32%</b> vs. 92.26%) and on the clinical data by about 24 points (FedProx, <b>75.83%</b> vs. 100%), while the four server-side optimizers (FedAvgM, FedAdam, FedYogi, FedAdagrad) collapse to near the chance level. The ranking is dataset-dependent, so no single algorithm is robust.",
        "<b>Effective compression through distillation.</b> Distillation transfers the teacher into a student that is <b>74.51% smaller</b> and roughly twice as fast at inference (about 50% lower latency), with five of seven objectives matching or surpassing the 92.44% teacher; the clinical task shows the same near-ceiling compression.",
        "<b>A controlled diagnosis of the combined pipeline.</b> Objectives that keep a hard-label cross-entropy term recover the student to near-centralized accuracy regardless of teacher quality — a collapsed teacher at 8.50% paired with Logit-MSE still yields a <b>92.94%</b> student, an <b>84.4-point</b> gap driven by the proxy labels, not by transfer. Objectives whose cross-entropy weight is exactly zero instead track the teacher (<i>r</i> ≈ 0.99 on the clinical grid). Two simple controls distinguish genuine transfer from this artifact."
      ]
    },
    {
      "type": "figure",
      "title": "Benchmark Pipeline",
      "image": "static/images/pipeline.jpg",
      "alt": "Two-stage FL and KD benchmark pipeline",
      "width": "100%",
      "caption": "<b>Two-stage FL–KD benchmark pipeline.</b> <b>Stage 1</b> (privacy-protected): five non-IID clients train on label-skewed slices of the dataset, and the server applies one of the thirteen benchmarked FL algorithms to produce a shared PointNet++ SSG teacher. <b>Stage 2</b>: the best FL teacher checkpoint supervises a compact student on the centralized training set with a KD objective, yielding a smaller and faster student model."
    },
    {
      "type": "group",
      "title": "Benchmark Design",
      "blocks": [
        { "type": "subtitle", "text": "Datasets & non-IID partitioning" },
        { "type": "text", "align": "justify", "body": "The benchmark evaluates two complementary datasets. <b>ModelNet40</b> provides point clouds over 40 shape categories with the standard normal-resampled split of 9,843 training and 2,468 test shapes, and serves to measure federated degradation at scale. The <b>craniosynostosis</b> dataset provides 3D head-surface shapes sampled from a statistical shape model, with four classes (a healthy control group and the coronal, metopic, and sagittal suture-fusion pathologies) and 100 instances per class, split deterministically 80/20 into 320 training and 80 test shapes; its near-perfect centralized ceiling lets teacher quality be read off unambiguously. Every shape is represented by 1,024 points with three spatial coordinates and no surface normals. To model federated deployment, each training set is partitioned across <b>five clients under an extreme label-skew (non-IID) strategy</b> — samples are sorted by class and cut into five disjoint contiguous slices, so each client concentrates on a few categories. Every configuration is repeated over three seeds {7, 42, 123}. The data loader is dataset-agnostic and also supports ModelNet10, OmniObject3D, YCB, and GazeboSim under the same interface." },
        { "type": "subtitle", "text": "Teacher & student" },
        { "type": "text", "align": "justify", "body": "The teacher is a <b>PointNet++ SSG</b> network — three hierarchical set-abstraction levels and a two-layer classification head — operating on raw coordinates without surface normals; it occupies 5.65 MB on ModelNet40 and 5.62 MB on the clinical data. The student, <b>SmallPointNet2</b>, keeps the same hierarchical structure with narrower layers at 1.44 MB on ModelNet40 (a <b>74.51% reduction</b>) and 1.42 MB on the clinical data, and exposes a penultimate feature so that feature-based distillation has a signal." },
        { "type": "subtitle", "text": "Federated & distillation protocol" },